{
  "$schema": "https://json-schema.org/draft/2020-12/schema",
  "$id": "https://conduit.dev/schemas/agent-manifest.schema.json",
  "title": "Meridian Agent Manifest (domain-team submission)",
  "description": "Canonical contract a domain team submits to register one agent. A2A-Agent-Card-aligned with gateway extensions (protocol, connection, constraints). Input/output schemas are DERIVED by the gateway via introspection and are NOT part of this submission. Validate submissions against this BEFORE introspection and storage.",
  "type": "object",
  "additionalProperties": false,
  "required": ["agent_id", "name", "description", "version", "provider", "domain", "audience", "protocol", "connection", "capabilities", "skills", "constraints"],
  "properties": {
    "agent_id": {
      "type": "string",
      "description": "Stable dotted identifier, e.g. acme.wealth.holdings",
      "pattern": "^[a-z0-9]+(\\.[a-z0-9_]+)+$"
    },
    "name": { "type": "string", "minLength": 1 },
    "description": { "type": "string", "minLength": 1 },
    "version": {
      "type": "string",
      "pattern": "^[0-9]+\\.[0-9]+\\.[0-9]+$",
      "description": "Semantic version, e.g. 1.0.0"
    },
    "provider": {
      "type": "object",
      "additionalProperties": false,
      "required": ["organization"],
      "properties": {
        "organization": { "type": "string", "minLength": 1 },
        "contactEmail": { "type": "string" }
      }
    },
    "domain": {
      "type": "string",
      "minLength": 1,
      "description": "World B: the business domain this agent belongs to. NOT enumerated here — a new domain onboards by adding its manifests; the gateway validates this against the loaded domain manifests at boot (DomainManifestStore), not against a hardcoded list."
    },
    "audience": {
      "type": "string",
      "enum": ["segment", "enterprise"],
      "description": "Who may reach this agent. 'segment' = gated by business-segment membership + per-segment classification. 'enterprise' = open to all authenticated users (segment gate skipped) — e.g. HR policy Q&A."
    },
    "protocol": {
      "type": "string",
      "description": "Gateway extension: which adapter invokes this agent.",
      "enum": ["http", "mcp", "a2a"]
    },
    "connection": {
      "type": "object",
      "description": "How to reach the agent. Required keys depend on protocol (see conditionals below)."
    },
    "capabilities": {
      "type": "object",
      "additionalProperties": true,
      "required": ["streaming"],
      "properties": {
        "streaming": { "type": "boolean" }
      }
    },
    "securitySchemes": {
      "type": "object",
      "description": "Optional, OpenAPI-aligned auth declaration."
    },
    "skills": {
      "type": "array",
      "minItems": 1,
      "items": {
        "type": "object",
        "additionalProperties": false,
        "required": ["id", "name", "description", "tags", "examples"],
        "properties": {
          "id": { "type": "string", "minLength": 1 },
          "name": { "type": "string", "minLength": 1 },
          "description": { "type": "string", "minLength": 1 },
          "tags": {
            "type": "array",
            "description": "Structured/faceted discovery keys.",
            "minItems": 1,
            "items": { "type": "string", "minLength": 1 }
          },
          "examples": {
            "type": "array",
            "description": "Representative prompts; embedded for semantic routing. At least 3.",
            "minItems": 3,
            "items": { "type": "string", "minLength": 1 }
          },
          "inputModes": { "type": "array", "items": { "type": "string" } },
          "outputModes": { "type": "array", "items": { "type": "string" } }
        }
      }
    },
    "constraints": {
      "type": "object",
      "additionalProperties": false,
      "description": "Scope-of-authority and operational limits.",
      "required": ["access_mode", "data_classification", "sla_timeout_ms"],
      "properties": {
        "access_mode": {
          "type": "string",
          "enum": ["read", "write"],
          "description": "Phase 1 agents MUST be \"read\"; the resolver/entitlement layer enforces read-only. Replaces the former boolean is_mutating."
        },
        "data_classification": {
          "type": "string",
          "enum": ["public", "internal", "confidential", "confidential-pii"]
        },
        "sla_timeout_ms": { "type": "integer", "minimum": 100, "maximum": 60000 },
        "rate_limit": {
          "type": "object",
          "additionalProperties": false,
          "required": ["requests", "per_seconds"],
          "properties": {
            "requests": { "type": "integer", "minimum": 1 },
            "per_seconds": { "type": "integer", "minimum": 1 }
          }
        }
      }
    },
    "sub_domain": {
      "type": "string",
      "description": "World B: sub-domain this agent belongs to within its domain (e.g. private-banking); resolves to a loaded sub-domain manifest."
    },
    "max_response_tokens": {
      "type": "integer",
      "minimum": 1,
      "maximum": 100000,
      "description": "World B: gateway truncates this agent's response to this many tokens before synthesis."
    },
    "io": {
      "type": "object",
      "additionalProperties": false,
      "description": "OPTIONAL semantic dataflow contract for multi-step (DAG) orchestration. This is NOT the wire input/output schema (that is still DERIVED via introspection) — it declares, in domain terms, what this capability NEEDS and what it PRODUCES, so the deterministic DAG resolver can wire dependent steps (producer.output type == downstream consumer.from). Capabilities without 'io' remain single-node (flat fan-out) only; the DAG path lights up per-capability as contracts are declared. World B: 'entity' references a sub-domain entity_types key; produced/consumed 'type' values are manifest-declared symbolic strings the gateway matches by equality — never hardcoded in gateway Java.",
      "properties": {
        "consumes": {
          "type": "array",
          "description": "Inputs this capability needs. Each item is EITHER an 'entity' (a leaf input, satisfied by deterministic entity resolution) OR a 'from' (an upstream capability's produced output 'type', which creates a DAG edge). Exactly one of the two per item.",
          "items": {
            "type": "object",
            "additionalProperties": false,
            "oneOf": [
              { "required": ["entity"] },
              { "required": ["from"] }
            ],
            "properties": {
              "entity": {
                "type": "string",
                "minLength": 1,
                "description": "A sub-domain entity_types 'key' this capability needs (e.g. relationship_id). Satisfied from the blackboard's resolved entities — no upstream agent required."
              },
              "from": {
                "type": "string",
                "minLength": 1,
                "description": "A produced-output 'type' that some upstream capability declares in its io.produces. Matching this creates a producer→consumer edge in the DAG."
              },
              "required": { "type": "boolean", "default": true },
              "select": {
                "type": "string",
                "minLength": 1,
                "description": "OPTIONAL, meaningful only alongside 'from': a JMESPath expression that projects/reshapes the producer's output into exactly what this consumer expects (field projection, not a blob pass-through). Absent = identity pass-through (today's behavior) — additive and backward-compatible. Evaluated by the gateway's Blackboard; matched/interpreted generically, never domain-hardcoded."
              }
            }
          }
        },
        "produces": {
          "type": "array",
          "description": "Named, typed outputs this capability places on the blackboard for downstream steps to consume via 'from'.",
          "items": {
            "type": "object",
            "additionalProperties": false,
            "required": ["name", "type"],
            "properties": {
              "name": {
                "type": "string",
                "minLength": 1,
                "description": "Blackboard key under which this capability's result is published for downstream binding."
              },
              "type": {
                "type": "string",
                "minLength": 1,
                "description": "Symbolic output type used to match a downstream consumer's 'from'. Manifest-declared; matched by string equality."
              }
            }
          }
        }
      }
    }
  },
  "allOf": [
    {
      "if": { "properties": { "protocol": { "const": "http" } } },
      "then": {
        "properties": {
          "connection": {
            "required": ["openapi_url", "operation_id"],
            "properties": {
              "openapi_url": { "type": "string" },
              "operation_id": { "type": "string" }
            }
          }
        }
      }
    },
    {
      "if": { "properties": { "protocol": { "const": "mcp" } } },
      "then": {
        "properties": {
          "connection": {
            "required": ["server_url", "tool"],
            "properties": {
              "server_url": { "type": "string" },
              "tool": { "type": "string" },
              "transport": { "type": "string", "enum": ["sse", "stdio"], "default": "sse" }
            }
          }
        }
      }
    },
    {
      "if": { "properties": { "protocol": { "const": "a2a" } } },
      "then": {
        "properties": {
          "connection": {
            "required": ["agent_card_url"],
            "properties": { "agent_card_url": { "type": "string" } }
          }
        }
      }
    }
  ]
}
