{
  "agent_id": "meridian.wealth.market_research",
  "name": "Wealth Market Research",
  "description": "Returns Meridian house-view commentary, sector outlooks, and macro analysis for wealth management clients. A knowledge agent — no client entity required. Available topics: equities, fixed_income, alternatives, macro. Omit topic for the broad quarterly outlook.",
  "version": "1.0.0",
  "provider": {
    "organization": "Meridian Demo Bank"
  },
  "domain": "wealth-management",
  "audience": "enterprise",
  "sub_domain": "market-research",
  "max_response_tokens": 2000,
  "protocol": "http",
  "connection": {
    "openapi_url": "http://wealth-market-research:8089/openapi.json",
    "operation_id": "get_market_research"
  },
  "capabilities": {
    "streaming": false,
    "pushNotifications": false
  },
  "skills": [
    {
      "id": "get_market_research",
      "name": "get_market_research",
      "description": "Retrieve Meridian house view, sector outlooks, and market commentary. No client entity required — general research available to all wealth segment users.",
      "tags": [
        "market-research",
        "house-view",
        "sector-outlook",
        "macro",
        "equities",
        "fixed-income",
        "alternatives",
        "wealth-management",
        "investment-strategy"
      ],
      "examples": [
        "what is the current house view on equities",
        "Meridian outlook on fixed income for this quarter",
        "what sectors do you recommend for H2 2026",
        "macro outlook and key risks",
        "what is the investment team's view on alternatives",
        "current market commentary",
        "house view on the market",
        "what is Meridian's view on private credit",
        "what sectors are overweight in the model portfolio"
      ],
      "inputModes": [
        "application/json"
      ],
      "outputModes": [
        "application/json"
      ]
    }
  ],
  "constraints": {
    "access_mode": "read",
    "data_classification": "internal",
    "sla_timeout_ms": 5000
  },
  "io": {
    "consumes": [],
    "produces": [
      { "name": "market_research", "type": "wealth.market_research" }
    ]
  }
}
