{
  "agent_id": "meridian.servicing.nav",
  "name": "Asset Servicing NAV",
  "description": "Returns net asset value and as-of date for a fund. NOTE: This agent is keyed by fund_id, NOT relationship_id. It is intentionally NOT selected by relationship-level hero prompts, demonstrating the resolver's selectivity \u2014 it will only be chosen when the user explicitly requests NAV for a specific fund.",
  "version": "1.0.0",
  "provider": {
    "organization": "Meridian Demo Bank"
  },
  "domain": "asset-servicing",
  "audience": "segment",
  "sub_domain": "corporate-actions",
  "max_response_tokens": 2000,
  "protocol": "mcp",
  "connection": {
    "server_url": "http://servicing-mcp:8082/mcp",
    "tool": "get_nav",
    "transport": "streamable"
  },
  "capabilities": {
    "streaming": false,
    "pushNotifications": false
  },
  "skills": [
    {
      "id": "get_nav",
      "name": "get_nav",
      "description": "Retrieve the net asset value and valuation date for a specific fund identified by fund_id.",
      "tags": [
        "nav",
        "net-asset-value",
        "fund",
        "valuation",
        "asset-servicing"
      ],
      "examples": [
        "latest NAV for fund X",
        "net asset value of the fund",
        "fund NAV as of today",
        "what's the NAV on fund 7781"
      ],
      "inputModes": [
        "application/json"
      ],
      "outputModes": [
        "application/json"
      ]
    }
  ],
  "constraints": {
    "access_mode": "read",
    "data_classification": "internal",
    "sla_timeout_ms": 30000
  },
  "io": {
    "consumes": [
      { "entity": "fund_id", "required": true }
    ],
    "produces": [
      { "name": "nav", "type": "servicing.nav" }
    ]
  }
}
