{
  "agent_id": "meridian.wealth.risk_profile",
  "name": "Wealth Risk Profile",
  "description": "Returns risk tolerance assessment and concentration flags for a given wealth management relationship. Accepts relationship_id as the primary key.",
  "version": "1.0.0",
  "provider": {
    "organization": "Meridian Demo Bank"
  },
  "domain": "wealth-management",
  "audience": "segment",
  "sub_domain": "private-banking",
  "max_response_tokens": 2000,
  "protocol": "http",
  "connection": {
    "openapi_url": "http://wealth-http:8081/openapi.json",
    "operation_id": "get_risk_profile_risk_profile_get"
  },
  "capabilities": {
    "streaming": false,
    "pushNotifications": false
  },
  "skills": [
    {
      "id": "get_risk_profile",
      "name": "get_risk_profile",
      "description": "Retrieve risk tolerance rating and concentration flags indicating portfolio risk exposures for a wealth relationship.",
      "tags": [
        "risk",
        "risk-profile",
        "concentration",
        "tolerance",
        "wealth-management"
      ],
      "examples": [
        "risk profile for this client",
        "how concentrated is this portfolio",
        "risk tolerance for the relationship",
        "any concentration flags on this account",
        "is this portfolio too aggressive for what the client said they could handle",
        "does the account's risk exposure match the client's stated tolerance",
        "is this allocation appropriate given the client's risk appetite",
        "risk profile for this relationship"
      ],
      "inputModes": [
        "application/json"
      ],
      "outputModes": [
        "application/json"
      ]
    }
  ],
  "constraints": {
    "access_mode": "read",
    "data_classification": "confidential-pii",
    "sla_timeout_ms": 30000
  },
  "io": {
    "consumes": [
      {
        "entity": "relationship_id",
        "required": true
      }
    ],
    "produces": [
      {
        "name": "risk_profile",
        "type": "wealth.risk_profile"
      }
    ]
  }
}
