{
  "agent_id": "acme.servicing.settlement_status",
  "name": "Asset Servicing Settlement Status",
  "description": "Returns pending and failed settlement records for a given relationship. Accepts relationship_id as the primary key. Accessed via MCP tool over SSE transport.",
  "version": "1.0.0",
  "provider": {
    "organization": "Meridian Demo Bank"
  },
  "domain": "asset-servicing",
  "audience": "segment",
  "sub_domain": "custody-operations",
  "max_response_tokens": 2000,
  "protocol": "mcp",
  "connection": {
    "server_url": "http://servicing-mcp:8082/sse",
    "tool": "get_settlements",
    "transport": "sse"
  },
  "capabilities": {
    "streaming": false,
    "pushNotifications": false
  },
  "skills": [
    {
      "id": "get_settlements",
      "name": "get_settlements",
      "description": "Retrieve pending and failed trade settlements for a given asset servicing relationship.",
      "tags": [
        "settlements",
        "pending",
        "failed-trades",
        "trade-status",
        "asset-servicing"
      ],
      "examples": [
        "any pending settlements on this account",
        "failed trades for the relationship",
        "settlement status for this client",
        "unsettled trades I should know about",
        "pending settlements for the Whitman Family Office relationship",
        "what are the outstanding trade settlements on the servicing side",
        "show me pending and failed settlements for this relationship",
        "settlement activity and trade status across wealth and servicing"
      ],
      "inputModes": [
        "application/json"
      ],
      "outputModes": [
        "application/json"
      ]
    }
  ],
  "constraints": {
    "access_mode": "read",
    "data_classification": "confidential",
    "sla_timeout_ms": 30000
  },
  "io": {
    "consumes": [
      { "entity": "relationship_id", "required": true }
    ],
    "produces": [
      { "name": "settlement_status", "type": "servicing.settlement_status" }
    ]
  }
}
