{
  "agent_id": "acme.wealth.holdings",
  "name": "Wealth Holdings",
  "description": "Returns the current portfolio positions and asset-class allocation for a given wealth management relationship. Accepts relationship_id as the primary key.",
  "version": "1.0.0",
  "provider": {
    "organization": "Meridian Demo Bank"
  },
  "domain": "wealth-management",
  "audience": "segment",
  "sub_domain": "private-banking",
  "max_response_tokens": 2000,
  "protocol": "http",
  "connection": {
    "openapi_url": "http://wealth-http:8081/openapi.json",
    "operation_id": "get_holdings_holdings_get"
  },
  "capabilities": {
    "streaming": false,
    "pushNotifications": false
  },
  "skills": [
    {
      "id": "get_holdings",
      "name": "get_holdings",
      "description": "Retrieve current holdings, positions, and asset allocation breakdown for a wealth relationship.",
      "tags": [
        "holdings",
        "portfolio",
        "positions",
        "allocation",
        "wealth-management"
      ],
      "examples": [
        "current holdings for the Whitman relationship",
        "portfolio allocation for this client",
        "what is this account invested in",
        "position breakdown for the relationship",
        "portfolio summary for this client",
        "portfolio value and top positions",
        "show me the portfolio for this relationship",
        "total portfolio value",
        "what does the portfolio hold"
      ],
      "inputModes": [
        "application/json"
      ],
      "outputModes": [
        "application/json"
      ]
    }
  ],
  "constraints": {
    "access_mode": "read",
    "data_classification": "confidential-pii",
    "sla_timeout_ms": 30000
  }
}
