{
  "agent_id": "meridian.insurance.policy_details",
  "name": "Insurance Policy Details",
  "description": "Returns the policy record for a commercial insurance policy: line of business, premium, coverage limit, deductible, status, and effective date. Accepts policy_id as the primary key.",
  "version": "1.0.0",
  "provider": {
    "organization": "Meridian Demo Bank"
  },
  "domain": "insurance",
  "audience": "segment",
  "sub_domain": "claims-servicing",
  "max_response_tokens": 2000,
  "protocol": "http",
  "connection": {
    "openapi_url": "http://insurance-http:8087/openapi.json",
    "operation_id": "get_policy_details"
  },
  "capabilities": {
    "streaming": false,
    "pushNotifications": false
  },
  "skills": [
    {
      "id": "get_policy_details",
      "name": "get_policy_details",
      "description": "Retrieve policy details \u2014 line of business, premium, coverage limit, deductible, status, and effective date \u2014 for a commercial insurance policy.",
      "tags": [
        "policy",
        "policy-details",
        "premium",
        "coverage-limit",
        "underwriting",
        "insurance"
      ],
      "examples": [
        "show me the policy details for the Continental Freight policy",
        "what is the coverage limit for this policy",
        "what is the premium for POL-77001",
        "what line of business is this policy",
        "is this policy active"
      ],
      "inputModes": [
        "application/json"
      ],
      "outputModes": [
        "application/json"
      ]
    }
  ],
  "constraints": {
    "access_mode": "read",
    "data_classification": "confidential-pii",
    "sla_timeout_ms": 30000
  },
  "io": {
    "consumes": [
      { "entity": "policy_id", "required": true }
    ],
    "produces": [
      { "name": "policy_record", "type": "insurance.policy_record" }
    ]
  }
}
